No,;Time;Source;Destination;;Length;Info;;;;;;;Time 1;Time 2;Delay;;Delay 1;Delay 2;Jitter
1;0;172,217,194,94;192,168,43,26;TCP;1414;80  >  59703 [ACK] Seq=1 Ack=1 Win=261 Len=1360;;;;;;;0;0,011258;0,011258;;-0,011064;0,000194;0,011258
2;0,011258;172,217,194,94;192,168,43,26;TCP;1414;80  >  59703 [ACK] Seq=1361 Ack=1 Win=261 Len=1360;;;;;;;0,011258;0,011452;0,000194;;0,008911;0,009105;0,000194
3;0,011452;192,168,43,26;172,217,194,94;TCP;54;59703  >  80 [ACK] Seq=1 Ack=2721 Win=520 Len=0;;;;;;;0,011452;0,020557;0,009105;;0,007235;0,01634;0,009105
4;0,020557;172,217,194,94;192,168,43,26;TCP;1414;80  >  59703 [ACK] Seq=2721 Ack=1 Win=261 Len=1360;;;;;;;0,020557;0,036897;0,01634;;-0,015984;0,000356;0,01634
5;0,036897;172,217,194,94;192,168,43,26;TCP;1414;80  >  59703 [ACK] Seq=4081 Ack=1 Win=261 Len=1360;;;;;;;0,036897;0,037253;0,000356;;0,014228;0,014584;0,000356
6;0,037253;192,168,43,26;172,217,194,94;TCP;54;59703  >  80 [ACK] Seq=1 Ack=5441 Win=520 Len=0;;;;;;;0,037253;0,051837;0,014584;;0,004444;0,019028;0,014584
7;0,051837;172,217,194,94;192,168,43,26;TCP;1414;80  >  59703 [ACK] Seq=5441 Ack=1 Win=261 Len=1360;;;;;;;0,051837;0,070865;0,019028;;-0,018768;0,00026;0,019028
8;0,070865;172,217,194,94;192,168,43,26;TCP;1414;80  >  59703 [ACK] Seq=6801 Ack=1 Win=261 Len=1360;;;;;;;0,070865;0,071125;0,00026;;0,016541;0,016801;0,00026
9;0,071125;192,168,43,26;172,217,194,94;TCP;54;59703  >  80 [ACK] Seq=1 Ack=8161 Win=520 Len=0;;;;;;;0,071125;0,087926;0,016801;;0,007109;0,02391;0,016801
10;0,087926;172,217,194,94;192,168,43,26;TCP;1414;80  >  59703 [ACK] Seq=8161 Ack=1 Win=261 Len=1360;;;;;;;0,087926;0,111836;0,02391;;-0,023649;0,000261;0,02391
11;0,111836;172,217,194,94;192,168,43,26;TCP;1414;80  >  59703 [ACK] Seq=9521 Ack=1 Win=261 Len=1360;;;;;;;0,111836;0,112097;0,000261;;0,010217;0,010478;0,000261
12;0,112097;192,168,43,26;172,217,194,94;TCP;54;59703  >  80 [ACK] Seq=1 Ack=10881 Win=520 Len=0;;;;;;;0,112097;0,122575;0,010478;;0,003858;0,014336;0,010478
13;0,122575;172,217,194,94;192,168,43,26;TCP;1414;80  >  59703 [ACK] Seq=10881 Ack=1 Win=261 Len=1360;;;;;;;0,122575;0,136911;0,014336;;-0,014109;0,000227;0,014336
14;0,136911;172,217,194,94;192,168,43,26;TCP;1414;80  >  59703 [ACK] Seq=12241 Ack=1 Win=261 Len=1360;;;;;;;0,136911;0,137138;0,000227;;0,012799;0,013026;0,000227
15;0,137138;192,168,43,26;172,217,194,94;TCP;54;59703  >  80 [ACK] Seq=1 Ack=13601 Win=520 Len=0;;;;;;;0,137138;0,150164;0,013026;;0,000948;0,013974;0,013026
16;0,150164;172,217,194,94;192,168,43,26;TCP;1414;80  >  59703 [ACK] Seq=13601 Ack=1 Win=261 Len=1360;;;;;;;0,150164;0,164138;0,013974;;-0,013748;0,000226;0,013974
17;0,164138;172,217,194,94;192,168,43,26;TCP;1414;80  >  59703 [ACK] Seq=14961 Ack=1 Win=261 Len=1360;;;;;;;0,164138;0,164364;0,000226;;0,034748;0,034974;0,000226
18;0,164364;192,168,43,26;172,217,194,94;TCP;54;59703  >  80 [ACK] Seq=1 Ack=16321 Win=520 Len=0;;;;;;;0,164364;0,199338;0,034974;;-0,034715;0,000259;0,034974
19;0,199338;172,217,194,94;192,168,43,26;TCP;1414;80  >  59703 [ACK] Seq=16321 Ack=1 Win=261 Len=1360;;;;;;;0,199338;0,199597;0,000259;;-9,1E-05;0,000168;0,000259
20;0,199597;172,217,194,94;192,168,43,26;TCP;1414;80  >  59703 [ACK] Seq=17681 Ack=1 Win=261 Len=1360;;;;;;;0,199597;0,199765;0,000168;;0,03122;0,031388;0,000168
21;0,199765;192,168,43,26;172,217,194,94;TCP;54;59703  >  80 [ACK] Seq=1 Ack=19041 Win=520 Len=0;;;;;;;0,199765;0,231153;0,031388;;-0,022031;0,009357;0,031388
22;0,231153;172,217,194,94;192,168,43,26;TCP;1414;80  >  59703 [ACK] Seq=19041 Ack=1 Win=261 Len=1360;;;;;;;0,231153;0,24051;0,009357;;-0,009173;0,000184;0,009357
23;0,24051;172,217,194,94;192,168,43,26;TCP;1414;80  >  59703 [ACK] Seq=20401 Ack=1 Win=261 Len=1360;;;;;;;0,24051;0,240694;0,000184;;0,014285;0,014469;0,000184
24;0,240694;192,168,43,26;172,217,194,94;TCP;54;59703  >  80 [ACK] Seq=1 Ack=21761 Win=520 Len=0;;;;;;;0,240694;0,255163;0,014469;;0,006556;0,021025;0,014469
25;0,255163;172,217,194,94;192,168,43,26;TCP;1414;80  >  59703 [ACK] Seq=21761 Ack=1 Win=261 Len=1360;;;;;;;0,255163;0,276188;0,021025;;-0,020801;0,000224;0,021025
26;0,276188;172,217,194,94;192,168,43,26;TCP;1414;80  >  59703 [ACK] Seq=23121 Ack=1 Win=261 Len=1360;;;;;;;0,276188;0,276412;0,000224;;0,008784;0,009008;0,000224
27;0,276412;192,168,43,26;172,217,194,94;TCP;54;59703  >  80 [ACK] Seq=1 Ack=24481 Win=520 Len=0;;;;;;;0,276412;0,28542;0,009008;;0,017446;0,026454;0,009008
28;0,28542;172,217,194,94;192,168,43,26;TCP;1414;80  >  59703 [ACK] Seq=24481 Ack=1 Win=261 Len=1360;;;;;;;0,28542;0,311874;0,026454;;-0,026201;0,000253;0,026454
29;0,311874;172,217,194,94;192,168,43,26;TCP;1414;80  >  59703 [ACK] Seq=25841 Ack=1 Win=261 Len=1360;;;;;;;0,311874;0,312127;0,000253;;0,005962;0,006215;0,000253
30;0,312127;192,168,43,26;172,217,194,94;TCP;54;59703  >  80 [ACK] Seq=1 Ack=27201 Win=520 Len=0;;;;;;;0,312127;0,318342;0,006215;;0,012683;0,018898;0,006215
31;0,318342;172,217,194,94;192,168,43,26;TCP;1414;80  >  59703 [ACK] Seq=27201 Ack=1 Win=261 Len=1360;;;;;;;0,318342;0,33724;0,018898;;-0,018619;0,000279;0,018898
32;0,33724;172,217,194,94;192,168,43,26;TCP;1414;80  >  59703 [ACK] Seq=28561 Ack=1 Win=261 Len=1360;;;;;;;0,33724;0,337519;0,000279;;0,014247;0,014526;0,000279
33;0,337519;192,168,43,26;172,217,194,94;TCP;54;59703  >  80 [ACK] Seq=1 Ack=29921 Win=520 Len=0;;;;;;;0,337519;0,352045;0,014526;;0,002097;0,016623;0,014526
34;0,352045;172,217,194,94;192,168,43,26;TCP;1414;80  >  59703 [ACK] Seq=29921 Ack=1 Win=261 Len=1360;;;;;;;0,352045;0,368668;0,016623;;-0,016365;0,000258;0,016623
35;0,368668;172,217,194,94;192,168,43,26;TCP;1414;80  >  59703 [ACK] Seq=31281 Ack=1 Win=261 Len=1360;;;;;;;0,368668;0,368926;0,000258;;0,00826;0,008518;0,000258
36;0,368926;192,168,43,26;172,217,194,94;TCP;54;59703  >  80 [ACK] Seq=1 Ack=32641 Win=520 Len=0;;;;;;;0,368926;0,377444;0,008518;;0,014415;0,022933;0,008518
37;0,377444;172,217,194,94;192,168,43,26;TCP;1414;80  >  59703 [ACK] Seq=32641 Ack=1 Win=261 Len=1360;;;;;;;0,377444;0,400377;0,022933;;-0,022692;0,000241;0,022933
38;0,400377;172,217,194,94;192,168,43,26;TCP;1414;80  >  59703 [ACK] Seq=34001 Ack=1 Win=261 Len=1360;;;;;;;0,400377;0,400618;0,000241;;0,014114;0,014355;0,000241
39;0,400618;192,168,43,26;172,217,194,94;TCP;54;59703  >  80 [ACK] Seq=1 Ack=35361 Win=520 Len=0;;;;;;;0,400618;0,414973;0,014355;;0,002244;0,016599;0,014355
40;0,414973;172,217,194,94;192,168,43,26;TCP;1414;80  >  59703 [ACK] Seq=35361 Ack=1 Win=261 Len=1360;;;;;;;0,414973;0,431572;0,016599;;-0,016362;0,000237;0,016599
41;0,431572;172,217,194,94;192,168,43,26;TCP;1414;80  >  59703 [ACK] Seq=36721 Ack=1 Win=261 Len=1360;;;;;;;0,431572;0,431809;0,000237;;0,014981;0,015218;0,000237
42;0,431809;192,168,43,26;172,217,194,94;TCP;54;59703  >  80 [ACK] Seq=1 Ack=38081 Win=520 Len=0;;;;;;;0,431809;0,447027;0,015218;;0,009188;0,024406;0,015218
43;0,447027;172,217,194,94;192,168,43,26;TCP;1414;80  >  59703 [ACK] Seq=38081 Ack=1 Win=261 Len=1360;;;;;;;0,447027;0,471433;0,024406;;-0,02414;0,000266;0,024406
44;0,471433;172,217,194,94;192,168,43,26;TCP;1414;80  >  59703 [ACK] Seq=39441 Ack=1 Win=261 Len=1360;;;;;;;0,471433;0,471699;0,000266;;0,02339;0,023656;0,000266
45;0,471699;192,168,43,26;172,217,194,94;TCP;54;59703  >  80 [ACK] Seq=1 Ack=40801 Win=520 Len=0;;;;;;;0,471699;0,495355;0,023656;;-0,008259;0,015397;0,023656
46;0,495355;172,217,194,94;192,168,43,26;TCP;1414;80  >  59703 [ACK] Seq=40801 Ack=1 Win=261 Len=1360;;;;;;;0,495355;0,510752;0,015397;;-0,015202;0,000195;0,015397
47;0,510752;172,217,194,94;192,168,43,26;TCP;1414;80  >  59703 [ACK] Seq=42161 Ack=1 Win=261 Len=1360;;;;;;;0,510752;0,510947;0,000195;;0,016548;0,016743;0,000195
48;0,510947;192,168,43,26;172,217,194,94;TCP;54;59703  >  80 [ACK] Seq=1 Ack=43521 Win=520 Len=0;;;;;;;0,510947;0,52769;0,016743;;0,006125;0,022868;0,016743
49;0,52769;172,217,194,94;192,168,43,26;TCP;1414;80  >  59703 [ACK] Seq=43521 Ack=1 Win=261 Len=1360;;;;;;;0,52769;0,550558;0,022868;;-0,022679;0,000189;0,022868
50;0,550558;172,217,194,94;192,168,43,26;TCP;1414;80  >  59703 [ACK] Seq=44881 Ack=1 Win=261 Len=1360;;;;;;;0,550558;0,550747;0,000189;;0,025559;0,025748;0,000189
51;0,550747;192,168,43,26;172,217,194,94;TCP;54;59703  >  80 [ACK] Seq=1 Ack=46241 Win=520 Len=0;;;;;;;0,550747;0,576495;0,025748;;-0,001618;0,02413;0,025748
52;0,576495;172,217,194,94;192,168,43,26;TCP;1414;80  >  59703 [ACK] Seq=46241 Ack=1 Win=261 Len=1360;;;;;;;0,576495;0,600625;0,02413;;-0,023893;0,000237;0,02413
53;0,600625;172,217,194,94;192,168,43,26;TCP;1414;80  >  59703 [ACK] Seq=47601 Ack=1 Win=261 Len=1360;;;;;;;0,600625;0,600862;0,000237;;0,004881;0,005118;0,000237
54;0,600862;192,168,43,26;172,217,194,94;TCP;54;59703  >  80 [ACK] Seq=1 Ack=48961 Win=520 Len=0;;;;;;;0,600862;0,60598;0,005118;;0,019094;0,024212;0,005118
55;0,60598;172,217,194,94;192,168,43,26;TCP;1414;80  >  59703 [ACK] Seq=48961 Ack=1 Win=261 Len=1360;;;;;;;0,60598;0,630192;0,024212;;-0,023956;0,000256;0,024212
56;0,630192;172,217,194,94;192,168,43,26;TCP;1414;80  >  59703 [ACK] Seq=50321 Ack=1 Win=261 Len=1360;;;;;;;0,630192;0,630448;0,000256;;0,012144;0,0124;0,000256
57;0,630448;192,168,43,26;172,217,194,94;TCP;54;59703  >  80 [ACK] Seq=1 Ack=51681 Win=520 Len=0;;;;;;;0,630448;0,642848;0,0124;;0,015755;0,028155;0,0124
58;0,642848;172,217,194,94;192,168,43,26;TCP;1414;80  >  59703 [ACK] Seq=51681 Ack=1 Win=261 Len=1360;;;;;;;0,642848;0,671003;0,028155;;-0,02788;0,000275;0,028155
59;0,671003;172,217,194,94;192,168,43,26;TCP;1414;80  >  59703 [ACK] Seq=53041 Ack=1 Win=261 Len=1360;;;;;;;0,671003;0,671278;0,000275;;0,00731;0,007585;0,000275
60;0,671278;192,168,43,26;172,217,194,94;TCP;54;59703  >  80 [ACK] Seq=1 Ack=54401 Win=520 Len=0;;;;;;;0,671278;0,678863;0,007585;;0,003954;0,011539;0,007585
61;0,678863;172,217,194,94;192,168,43,26;TCP;1414;80  >  59703 [ACK] Seq=54401 Ack=1 Win=261 Len=1360;;;;;;;0,678863;0,690402;0,011539;;-0,011352;0,000187;0,011539
62;0,690402;172,217,194,94;192,168,43,26;TCP;1414;80  >  59703 [ACK] Seq=55761 Ack=1 Win=261 Len=1360;;;;;;;0,690402;0,690589;0,000187;;0,029988;0,030175;0,000187
63;0,690589;192,168,43,26;172,217,194,94;TCP;54;59703  >  80 [ACK] Seq=1 Ack=57121 Win=520 Len=0;;;;;;;0,690589;0,720764;0,030175;;-0,029866;0,000309;0,030175
64;0,720764;172,217,194,94;192,168,43,26;TCP;1414;80  >  59703 [ACK] Seq=57121 Ack=1 Win=261 Len=1360;;;;;;;0,720764;0,721073;0,000309;;-0,000138;0,000171;0,000309
65;0,721073;172,217,194,94;192,168,43,26;TCP;1414;80  >  59703 [ACK] Seq=58481 Ack=1 Win=261 Len=1360;;;;;;;0,721073;0,721244;0,000171;;0,029967;0,030138;0,000171
66;0,721244;192,168,43,26;172,217,194,94;TCP;54;59703  >  80 [ACK] Seq=1 Ack=59841 Win=520 Len=0;;;;;;;0,721244;0,751382;0,030138;;-0,014962;0,015176;0,030138
67;0,751382;172,217,194,94;192,168,43,26;TCP;1414;80  >  59703 [ACK] Seq=59841 Ack=1 Win=261 Len=1360;;;;;;;0,751382;0,766558;0,015176;;-0,014923;0,000253;0,015176
68;0,766558;172,217,194,94;192,168,43,26;TCP;1414;80  >  59703 [ACK] Seq=61201 Ack=1 Win=261 Len=1360;;;;;;;0,766558;0,766811;0,000253;;0,032885;0,033138;0,000253
69;0,766811;192,168,43,26;172,217,194,94;TCP;54;59703  >  80 [ACK] Seq=1 Ack=62561 Win=520 Len=0;;;;;;;0,766811;0,799949;0,033138;;-0,0267;0,006438;0,033138
70;0,799949;172,217,194,94;192,168,43,26;TCP;1414;80  >  59703 [ACK] Seq=62561 Ack=1 Win=261 Len=1360;;;;;;;0,799949;0,806387;0,006438;;-0,006202;0,000236;0,006438
71;0,806387;172,217,194,94;192,168,43,26;TCP;1414;80  >  59703 [ACK] Seq=63921 Ack=1 Win=261 Len=1360;;;;;;;0,806387;0,806623;0,000236;;0,023498;0,023734;0,000236
72;0,806623;192,168,43,26;172,217,194,94;TCP;54;59703  >  80 [ACK] Seq=1 Ack=65281 Win=520 Len=0;;;;;;;0,806623;0,830357;0,023734;;-0,009662;0,014072;0,023734
73;0,830357;172,217,194,94;192,168,43,26;TCP;1414;80  >  59703 [ACK] Seq=65281 Ack=1 Win=261 Len=1360;;;;;;;0,830357;0,844429;0,014072;;-0,013886;0,000186;0,014072
74;0,844429;172,217,194,94;192,168,43,26;TCP;1414;80  >  59703 [ACK] Seq=66641 Ack=1 Win=261 Len=1360;;;;;;;0,844429;0,844615;0,000186;;0,031802;0,031988;0,000186
75;0,844615;192,168,43,26;172,217,194,94;TCP;54;59703  >  80 [ACK] Seq=1 Ack=68001 Win=520 Len=0;;;;;;;0,844615;0,876603;0,031988;;-0,016362;0,015626;0,031988
76;0,876603;172,217,194,94;192,168,43,26;TCP;1414;80  >  59703 [ACK] Seq=68001 Ack=1 Win=261 Len=1360;;;;;;;0,876603;0,892229;0,015626;;-0,015393;0,000233;0,015626
77;0,892229;172,217,194,94;192,168,43,26;TCP;1414;80  >  59703 [ACK] Seq=69361 Ack=1 Win=261 Len=1360;;;;;;;0,892229;0,892462;0,000233;;0,024493;0,024726;0,000233
78;0,892462;192,168,43,26;172,217,194,94;TCP;54;59703  >  80 [ACK] Seq=1 Ack=70721 Win=520 Len=0;;;;;;;0,892462;0,917188;0,024726;;-0,016724;0,008002;0,024726
79;0,917188;172,217,194,94;192,168,43,26;TCP;1414;80  >  59703 [ACK] Seq=70721 Ack=1 Win=261 Len=1360;;;;;;;0,917188;0,92519;0,008002;;-0,007764;0,000238;0,008002
80;0,92519;172,217,194,94;192,168,43,26;TCP;1414;80  >  59703 [ACK] Seq=72081 Ack=1 Win=261 Len=1360;;;;;;;0,92519;0,925428;0,000238;;0,022809;0,023047;0,000238
81;0,925428;192,168,43,26;172,217,194,94;TCP;54;59703  >  80 [ACK] Seq=1 Ack=73441 Win=520 Len=0;;;;;;;0,925428;0,948475;0,023047;;-0,011054;0,011993;0,023047
82;0,948475;172,217,194,94;192,168,43,26;TCP;1414;80  >  59703 [ACK] Seq=73441 Ack=1 Win=261 Len=1360;;;;;;;0,948475;0,960468;0,011993;;-0,011773;0,00022;0,011993
83;0,960468;172,217,194,94;192,168,43,26;TCP;1414;80  >  59703 [ACK] Seq=74801 Ack=1 Win=261 Len=1360;;;;;;;0,960468;0,960688;0,00022;;0,011389;0,011609;0,00022
84;0,960688;192,168,43,26;172,217,194,94;TCP;54;59703  >  80 [ACK] Seq=1 Ack=76161 Win=520 Len=0;;;;;;;0,960688;0,972297;0,011609;;0,00681;0,018419;0,011609
85;0,972297;172,217,194,94;192,168,43,26;TCP;1414;80  >  59703 [ACK] Seq=76161 Ack=1 Win=261 Len=1360;;;;;;;0,972297;0,990716;0,018419;;-0,018166;0,000253;0,018419
86;0,990716;172,217,194,94;192,168,43,26;TCP;1414;80  >  59703 [ACK] Seq=77521 Ack=1 Win=261 Len=1360;;;;;;;0,990716;0,990969;0,000253;;0,01143;0,011683;0,000253
87;0,990969;192,168,43,26;172,217,194,94;TCP;54;59703  >  80 [ACK] Seq=1 Ack=78881 Win=520 Len=0;;;;;;;0,990969;1,002652;0,011683;;0,004951;0,016634;0,011683
88;1,002652;172,217,194,94;192,168,43,26;TCP;1414;80  >  59703 [ACK] Seq=78881 Ack=1 Win=261 Len=1360;;;;;;;1,002652;1,019286;0,016634;;-0,016434;0,0002;0,016634
89;1,019286;172,217,194,94;192,168,43,26;TCP;1414;80  >  59703 [ACK] Seq=80241 Ack=1 Win=261 Len=1360;;;;;;;1,019286;1,019486;0,0002;;0,012236;0,012436;0,0002
90;1,019486;192,168,43,26;172,217,194,94;TCP;54;59703  >  80 [ACK] Seq=1 Ack=81601 Win=520 Len=0;;;;;;;1,019486;1,031922;0,012436;;-0,000313;0,012123;0,012436
91;1,031922;172,217,194,94;192,168,43,26;TCP;1414;80  >  59703 [ACK] Seq=81601 Ack=1 Win=261 Len=1360;;;;;;;1,031922;1,044045;0,012123;;-0,011826;0,000297;0,012123
92;1,044045;172,217,194,94;192,168,43,26;TCP;1414;80  >  59703 [ACK] Seq=82961 Ack=1 Win=261 Len=1360;;;;;;;1,044045;1,044342;0,000297;;0,035565;0,035862;0,000297
93;1,044342;192,168,43,26;172,217,194,94;TCP;54;59703  >  80 [ACK] Seq=1 Ack=84321 Win=520 Len=0;;;;;;;1,044342;1,080204;0,035862;;-0,02855;0,007312;0,035862
94;1,080204;172,217,194,94;192,168,43,26;TCP;1414;80  >  59703 [ACK] Seq=84321 Ack=1 Win=261 Len=1360;;;;;;;1,080204;1,087516;0,007312;;-0,007069;0,000243;0,007312
95;1,087516;172,217,194,94;192,168,43,26;TCP;1414;80  >  59703 [ACK] Seq=85681 Ack=1 Win=261 Len=1360;;;;;;;1,087516;1,087759;0,000243;;0,00455;0,004793;0,000243
96;1,087759;192,168,43,26;172,217,194,94;TCP;54;59703  >  80 [ACK] Seq=1 Ack=87041 Win=520 Len=0;;;;;;;1,087759;1,092552;0,004793;;-0,003926;0,000867;0,004793
97;1,092552;192,168,43,26;20,189,123,78;TLSv1,2;148;Application Data;;;;;;;1,092552;1,093419;0,000867;;-0,000867;0;0,000867
98;1,093419;192,168,43,26;20,189,123,78;TCP;1414;59704  >  443 [ACK] Seq=95 Ack=1 Win=1020 Len=1360 [TCP segment of a reassembled PDU];;;;;;;1,093419;1,093419;0;;0,017159;0,017159;0
99;1,093419;192,168,43,26;20,189,123,78;TLSv1,2;350;Application Data;;;;;;;1,093419;1,110578;0,017159;;0,004859;0,022018;0,017159
100;1,110578;172,217,194,94;192,168,43,26;TCP;1414;80  >  59703 [ACK] Seq=87041 Ack=1 Win=261 Len=1360;;;;;;;1,110578;1,132596;0,022018;;-0,021817;0,000201;0,022018
101;1,132596;172,217,194,94;192,168,43,26;TCP;1414;80  >  59703 [ACK] Seq=88401 Ack=1 Win=261 Len=1360;;;;;;;1,132596;1,132797;0,000201;;0,019249;0,01945;0,000201
102;1,132797;192,168,43,26;172,217,194,94;TCP;54;59703  >  80 [ACK] Seq=1 Ack=89761 Win=520 Len=0;;;;;;;1,132797;1,152247;0,01945;;-0,019181;0,000269;0,01945
103;1,152247;172,217,194,94;192,168,43,26;TCP;1414;80  >  59703 [ACK] Seq=89761 Ack=1 Win=261 Len=1360;;;;;;;1,152247;1,152516;0,000269;;-7,8E-05;0,000191;0,000269
104;1,152516;172,217,194,94;192,168,43,26;TCP;1414;80  >  59703 [ACK] Seq=91121 Ack=1 Win=261 Len=1360;;;;;;;1,152516;1,152707;0,000191;;0,022769;0,02296;0,000191
105;1,152707;192,168,43,26;172,217,194,94;TCP;54;59703  >  80 [ACK] Seq=1 Ack=92481 Win=520 Len=0;;;;;;;1,152707;1,175667;0,02296;;-0,002132;0,020828;0,02296
106;1,175667;172,217,194,94;192,168,43,26;TCP;1414;80  >  59703 [ACK] Seq=92481 Ack=1 Win=261 Len=1360;;;;;;;1,175667;1,196495;0,020828;;-0,02063;0,000198;0,020828
107;1,196495;172,217,194,94;192,168,43,26;TCP;1414;80  >  59703 [ACK] Seq=93841 Ack=1 Win=261 Len=1360;;;;;;;1,196495;1,196693;0,000198;;0,001997;0,002195;0,000198
108;1,196693;192,168,43,26;172,217,194,94;TCP;54;59703  >  80 [ACK] Seq=1 Ack=95201 Win=520 Len=0;;;;;;;1,196693;1,198888;0,002195;;0,013432;0,015627;0,002195
109;1,198888;172,217,194,94;192,168,43,26;TCP;1414;80  >  59703 [ACK] Seq=95201 Ack=1 Win=261 Len=1360;;;;;;;1,198888;1,214515;0,015627;;-0,015429;0,000198;0,015627
110;1,214515;172,217,194,94;192,168,43,26;TCP;1414;80  >  59703 [ACK] Seq=96561 Ack=1 Win=261 Len=1360;;;;;;;1,214515;1,214713;0,000198;;0,022936;0,023134;0,000198
111;1,214713;192,168,43,26;172,217,194,94;TCP;54;59703  >  80 [ACK] Seq=1 Ack=97921 Win=520 Len=0;;;;;;;1,214713;1,237847;0,023134;;-0,022731;0,000403;0,023134
112;1,237847;172,217,194,94;192,168,43,26;TCP;1414;80  >  59703 [ACK] Seq=97921 Ack=1 Win=261 Len=1360;;;;;;;1,237847;1,238250;0,000403;;-0,000403;0;0,000403
113;1,238250;20,189,123,78;192,168,43,26;TCP;54;443  >  59704 [ACK] Seq=1 Ack=95 Win=36849 Len=0;;;;;;;1,238250;1,238250;0;;0,000282;0,000282;0
114;1,238250;172,217,194,94;192,168,43,26;TCP;1414;80  >  59703 [ACK] Seq=99281 Ack=1 Win=261 Len=1360;;;;;;;1,238250;1,238532;0,000282;;0,031373;0,031655;0,000282
115;1,238532;192,168,43,26;172,217,194,94;TCP;54;59703  >  80 [ACK] Seq=1 Ack=100641 Win=520 Len=0;;;;;;;1,238532;1,270187;0,031655;;-0,031192;0,000463;0,031655
116;1,270187;172,217,194,94;192,168,43,26;TCP;1414;80  >  59703 [ACK] Seq=100641 Ack=1 Win=261 Len=1360;;;;;;;1,270187;1,270650;0,000463;;-0,000463;0;0,000463
117;1,270650;20,189,123,78;192,168,43,26;TCP;66;[TCP Dup ACK 113#1] 443  >  59704 [ACK] Seq=1 Ack=95 Win=36849 Len=0 SLE=1455 SRE=1751;;;;;;;1,270650;1,270650;0;;0,011926;0,011926;0
118;1,270650;20,189,123,78;192,168,43,26;TCP;54;443  >  59704 [ACK] Seq=1 Ack=1751 Win=38505 Len=0;;;;;;;1,270650;1,282576;0,011926;;-0,01173;0,000196;0,011926
119;1,282576;172,217,194,94;192,168,43,26;TCP;1414;80  >  59703 [ACK] Seq=102001 Ack=1 Win=261 Len=1360;;;;;;;1,282576;1,282772;0,000196;;0,027492;0,027688;0,000196
120;1,282772;192,168,43,26;172,217,194,94;TCP;54;59703  >  80 [ACK] Seq=1 Ack=103361 Win=520 Len=0;;;;;;;1,282772;1,310460;0,027688;;-0,023781;0,003907;0,027688
121;1,310460;172,217,194,94;192,168,43,26;TCP;1414;80  >  59703 [ACK] Seq=103361 Ack=1 Win=261 Len=1360;;;;;;;1,310460;1,314367;0,003907;;-0,003728;0,000179;0,003907
122;1,314367;172,217,194,94;192,168,43,26;TCP;1414;80  >  59703 [ACK] Seq=104721 Ack=1 Win=261 Len=1360;;;;;;;1,314367;1,314546;0,000179;;0,005087;0,005266;0,000179
123;1,314546;192,168,43,26;172,217,194,94;TCP;54;59703  >  80 [ACK] Seq=1 Ack=106081 Win=520 Len=0;;;;;;;1,314546;1,319812;0,005266;;-0,005073;0,000193;0,005266
124;1,319812;20,189,123,78;192,168,43,26;TLSv1,2;109;Application Data;;;;;;;1,319812;1,320005;0,000193;;-2,1E-05;0,000172;0,000193
125;1,320005;192,168,43,26;20,189,123,78;TCP;54;59704  >  443 [ACK] Seq=1751 Ack=56 Win=1020 Len=0;;;;;;;1,320005;1,320177;0,000172;;-0,000172;0;0,000172
126;1,320177;20,189,123,78;192,168,43,26;TLSv1,2;224;Application Data;;;;;;;1,320177;1,320177;0;;0,00025;0,00025;0
127;1,320177;172,217,194,94;192,168,43,26;TCP;1414;80  >  59703 [ACK] Seq=106081 Ack=1 Win=261 Len=1360;;;;;;;1,320177;1,320427;0,00025;;0,031055;0,031305;0,00025
128;1,320427;192,168,43,26;20,189,123,78;TCP;54;59704  >  443 [ACK] Seq=1751 Ack=226 Win=1019 Len=0;;;;;;;1,320427;1,351732;0,031305;;-0,031106;0,000199;0,031305
129;1,351732;172,217,194,94;192,168,43,26;TCP;1414;80  >  59703 [ACK] Seq=107441 Ack=1 Win=261 Len=1360;;;;;;;1,351732;1,351931;0,000199;;0,024198;0,024397;0,000199
130;1,351931;192,168,43,26;172,217,194,94;TCP;54;59703  >  80 [ACK] Seq=1 Ack=108801 Win=520 Len=0;;;;;;;1,351931;1,376328;0,024397;;-0,001631;0,022766;0,024397
131;1,376328;172,217,194,94;192,168,43,26;TCP;1414;80  >  59703 [ACK] Seq=108801 Ack=1 Win=261 Len=1360;;;;;;;1,376328;1,399094;0,022766;;-0,008508;0,014258;0,022766
132;1,399094;192,168,43,26;20,189,123,78;TLSv1,2;92;Application Data;;;;;;;1,399094;1,413352;0,014258;;-0,014056;0,000202;0,014258
133;1,413352;172,217,194,94;192,168,43,26;TCP;1414;80  >  59703 [ACK] Seq=110161 Ack=1 Win=261 Len=1360;;;;;;;1,413352;1,413554;0,000202;;-4,1E-05;0,000161;0,000202
134;1,413554;192,168,43,26;172,217,194,94;TCP;54;59703  >  80 [ACK] Seq=1 Ack=111521 Win=520 Len=0;;;;;;;1,413554;1,413715;0,000161;;0,017208;0,017369;0,000161
135;1,413715;172,217,194,94;192,168,43,26;TCP;1414;80  >  59703 [ACK] Seq=111521 Ack=1 Win=261 Len=1360;;;;;;;1,413715;1,431084;0,017369;;-0,017182;0,000187;0,017369
136;1,431084;172,217,194,94;192,168,43,26;TCP;1414;80  >  59703 [ACK] Seq=112881 Ack=1 Win=261 Len=1360;;;;;;;1,431084;1,431271;0,000187;;0,023623;0,02381;0,000187
137;1,431271;192,168,43,26;172,217,194,94;TCP;54;59703  >  80 [ACK] Seq=1 Ack=114241 Win=520 Len=0;;;;;;;1,431271;1,455081;0,02381;;-0,007952;0,015858;0,02381
138;1,455081;172,217,194,94;192,168,43,26;TCP;1414;80  >  59703 [ACK] Seq=114241 Ack=1 Win=261 Len=1360;;;;;;;1,455081;1,470939;0,015858;;-0,015666;0,000192;0,015858
140;1,470939;172,217,194,94;192,168,43,26;TCP;1414;80  >  59703 [ACK] Seq=115601 Ack=1 Win=261 Len=1360;;;;;;;1,470939;1,471131;0,000192;;0,007798;0,00799;0,000192
141;1,471131;192,168,43,26;172,217,194,94;TCP;54;59703  >  80 [ACK] Seq=1 Ack=116961 Win=520 Len=0;;;;;;;1,471131;1,479121;0,00799;;0,011641;0,019631;0,00799
142;1,479121;172,217,194,94;192,168,43,26;TCP;1414;80  >  59703 [ACK] Seq=116961 Ack=1 Win=261 Len=1360;;;;;;;1,479121;1,498752;0,019631;;-0,019387;0,000244;0,019631
143;1,498752;172,217,194,94;192,168,43,26;TCP;1414;80  >  59703 [ACK] Seq=118321 Ack=1 Win=261 Len=1360;;;;;;;1,498752;1,498996;0,000244;;0,017817;0,018061;0,000244
144;1,498996;192,168,43,26;172,217,194,94;TCP;54;59703  >  80 [ACK] Seq=1 Ack=119681 Win=520 Len=0;;;;;;;1,498996;1,517057;0,018061;;0,000323;0,018384;0,018061
145;1,517057;172,217,194,94;192,168,43,26;TCP;1414;80  >  59703 [ACK] Seq=119681 Ack=1 Win=261 Len=1360;;;;;;;1,517057;1,535441;0,018384;;-0,018087;0,000297;0,018384
146;1,535441;172,217,194,94;192,168,43,26;TCP;1414;80  >  59703 [ACK] Seq=121041 Ack=1 Win=261 Len=1360;;;;;;;1,535441;1,535738;0,000297;;0,018404;0,018701;0,000297
147;1,535738;192,168,43,26;172,217,194,94;TCP;54;59703  >  80 [ACK] Seq=1 Ack=122401 Win=520 Len=0;;;;;;;1,535738;1,554439;0,018701;;-0,017006;0,001695;0,018701
148;1,554439;172,217,194,94;192,168,43,26;TCP;1414;80  >  59703 [ACK] Seq=122401 Ack=1 Win=261 Len=1360;;;;;;;1,554439;1,556134;0,001695;;0,00404;0,005735;0,001695
149;1,556134;20,189,123,78;192,168,43,26;TCP;54;443  >  59704 [ACK] Seq=226 Ack=1789 Win=38543 Len=0;;;;;;;1,556134;1,561869;0,005735;;-0,005485;0,00025;0,005735
150;1,561869;172,217,194,94;192,168,43,26;TCP;1414;80  >  59703 [ACK] Seq=123761 Ack=1 Win=261 Len=1360;;;;;;;1,561869;1,562119;0,00025;;0,012392;0,012642;0,00025
151;1,562119;192,168,43,26;172,217,194,94;TCP;54;59703  >  80 [ACK] Seq=1 Ack=125121 Win=520 Len=0;;;;;;;1,562119;1,574761;0,012642;;0,007861;0,020503;0,012642
152;1,574761;172,217,194,94;192,168,43,26;TCP;1414;80  >  59703 [ACK] Seq=125121 Ack=1 Win=261 Len=1360;;;;;;;1,574761;1,595264;0,020503;;-0,020274;0,000229;0,020503
153;1,595264;172,217,194,94;192,168,43,26;TCP;1414;80  >  59703 [ACK] Seq=126481 Ack=1 Win=261 Len=1360;;;;;;;1,595264;1,595493;0,000229;;0,013958;0,014187;0,000229
154;1,595493;192,168,43,26;172,217,194,94;TCP;54;59703  >  80 [ACK] Seq=1 Ack=127841 Win=520 Len=0;;;;;;;1,595493;1,609680;0,014187;;0,007752;0,021939;0,014187
155;1,609680;172,217,194,94;192,168,43,26;TCP;1414;80  >  59703 [ACK] Seq=127841 Ack=1 Win=261 Len=1360;;;;;;;1,609680;1,631619;0,021939;;-0,021693;0,000246;0,021939
156;1,631619;172,217,194,94;192,168,43,26;TCP;1414;80  >  59703 [ACK] Seq=129201 Ack=1 Win=261 Len=1360;;;;;;;1,631619;1,631865;0,000246;;0,009269;0,009515;0,000246
157;1,631865;192,168,43,26;172,217,194,94;TCP;54;59703  >  80 [ACK] Seq=1 Ack=130561 Win=520 Len=0;;;;;;;1,631865;1,641380;0,009515;;-0,004689;0,004826;0,009515
158;1,641380;172,217,194,94;192,168,43,26;TCP;1414;80  >  59703 [ACK] Seq=130561 Ack=1 Win=261 Len=1360;;;;;;;1,641380;1,646206;0,004826;;-0,004592;0,000234;0,004826
159;1,646206;172,217,194,94;192,168,43,26;TCP;1414;80  >  59703 [ACK] Seq=131921 Ack=1 Win=261 Len=1360;;;;;;;1,646206;1,646440;0,000234;;0,031847;0,032081;0,000234
160;1,646440;192,168,43,26;172,217,194,94;TCP;54;59703  >  80 [ACK] Seq=1 Ack=133281 Win=520 Len=0;;;;;;;1,646440;1,678521;0,032081;;-0,024112;0,007969;0,032081
161;1,678521;172,217,194,94;192,168,43,26;TCP;1414;80  >  59703 [ACK] Seq=133281 Ack=1 Win=261 Len=1360;;;;;;;1,678521;1,686490;0,007969;;-0,007691;0,000278;0,007969
162;1,686490;172,217,194,94;192,168,43,26;TCP;1414;80  >  59703 [ACK] Seq=134641 Ack=1 Win=261 Len=1360;;;;;;;1,686490;1,686768;0,000278;;0,020578;0,020856;0,000278
163;1,686768;192,168,43,26;172,217,194,94;TCP;54;59703  >  80 [ACK] Seq=1 Ack=136001 Win=520 Len=0;;;;;;;1,686768;1,707624;0,020856;;-0,019027;0,001829;0,020856
164;1,707624;192,168,43,26;20,189,123,78;TLSv1,2;105;Application Data;;;;;;;1,707624;1,709453;0,001829;;-0,001829;0;0,001829
165;1,709453;192,168,43,26;20,189,123,78;TCP;1414;59704  >  443 [ACK] Seq=1840 Ack=226 Win=1019 Len=1360 [TCP segment of a reassembled PDU];;;;;;;1,709453;1,709453;0;;0,000557;0,000557;0
166;1,709453;192,168,43,26;20,189,123,78;TLSv1,2;345;Application Data;;;;;;;1,709453;1,710010;0,000557;;0,002128;0,002685;0,000557
167;1,710010;192,168,43,26;20,189,123,78;TLSv1,2;92;Application Data;;;;;;;1,710010;1,712695;0,002685;;0,006032;0,008717;0,002685
168;1,712695;172,217,194,94;192,168,43,26;TCP;1414;80  >  59703 [ACK] Seq=136001 Ack=1 Win=261 Len=1360;;;;;;;1,712695;1,721412;0,008717;;-0,008459;0,000258;0,008717
169;1,721412;172,217,194,94;192,168,43,26;TCP;1414;80  >  59703 [ACK] Seq=137361 Ack=1 Win=261 Len=1360;;;;;;;1,721412;1,721670;0,000258;;0,012999;0,013257;0,000258
170;1,721670;192,168,43,26;172,217,194,94;TCP;54;59703  >  80 [ACK] Seq=1 Ack=138721 Win=520 Len=0;;;;;;;1,721670;1,734927;0,013257;;0,003176;0,016433;0,013257
171;1,734927;172,217,194,94;192,168,43,26;TCP;1414;80  >  59703 [ACK] Seq=138721 Ack=1 Win=261 Len=1360;;;;;;;1,734927;1,751360;0,016433;;-0,016199;0,000234;0,016433
172;1,751360;172,217,194,94;192,168,43,26;TCP;1414;80  >  59703 [ACK] Seq=140081 Ack=1 Win=261 Len=1360;;;;;;;1,751360;1,751594;0,000234;;0,02181;0,022044;0,000234
173;1,751594;192,168,43,26;172,217,194,94;TCP;54;59703  >  80 [ACK] Seq=1 Ack=141441 Win=520 Len=0;;;;;;;1,751594;1,773638;0,022044;;-0,021788;0,000256;0,022044
174;1,773638;172,217,194,94;192,168,43,26;TCP;1414;80  >  59703 [ACK] Seq=141441 Ack=1 Win=261 Len=1360;;;;;;;1,773638;1,773894;0,000256;;-3,5E-05;0,000221;0,000256
175;1,773894;172,217,194,94;192,168,43,26;TCP;1414;80  >  59703 [ACK] Seq=142801 Ack=1 Win=261 Len=1360;;;;;;;1,773894;1,774115;0,000221;;0,022532;0,022753;0,000221
176;1,774115;192,168,43,26;172,217,194,94;TCP;54;59703  >  80 [ACK] Seq=1 Ack=144161 Win=520 Len=0;;;;;;;1,774115;1,796868;0,022753;;0,010709;0,033462;0,022753
177;1,796868;172,217,194,94;192,168,43,26;TCP;1414;80  >  59703 [ACK] Seq=144161 Ack=1 Win=261 Len=1360;;;;;;;1,796868;1,830330;0,033462;;-0,033223;0,000239;0,033462
178;1,830330;172,217,194,94;192,168,43,26;TCP;1414;80  >  59703 [ACK] Seq=145521 Ack=1 Win=261 Len=1360;;;;;;;1,830330;1,830569;0,000239;;4,6E-05;0,000285;0,000239
179;1,830569;192,168,43,26;172,217,194,94;TCP;54;59703  >  80 [ACK] Seq=1 Ack=146881 Win=520 Len=0;;;;;;;1,830569;1,830854;0,000285;;-0,000285;0;0,000285
180;1,830854;20,189,123,78;192,168,43,26;TCP;54;443  >  59704 [ACK] Seq=226 Ack=1840 Win=38594 Len=0;;;;;;;1,830854;1,830854;0;;0,01449;0,01449;0
181;1,830854;20,189,123,78;192,168,43,26;TCP;54;443  >  59704 [ACK] Seq=226 Ack=3529 Win=40283 Len=0;;;;;;;1,830854;1,845344;0,01449;;-0,003044;0,011446;0,01449
182;1,845344;172,217,194,94;192,168,43,26;TCP;1414;80  >  59703 [ACK] Seq=146881 Ack=1 Win=261 Len=1360;;;;;;;1,845344;1,856790;0,011446;;-0,011261;0,000185;0,011446
183;1,856790;172,217,194,94;192,168,43,26;TCP;1414;80  >  59703 [ACK] Seq=148241 Ack=1 Win=261 Len=1360;;;;;;;1,856790;1,856975;0,000185;;0,025408;0,025593;0,000185
184;1,856975;192,168,43,26;172,217,194,94;TCP;54;59703  >  80 [ACK] Seq=1 Ack=149601 Win=520 Len=0;;;;;;;1,856975;1,882568;0,025593;;-0,025373;0,00022;0,025593
185;1,882568;172,217,194,94;192,168,43,26;TCP;1414;80  >  59703 [ACK] Seq=149601 Ack=1 Win=261 Len=1360;;;;;;;1,882568;1,882788;0,00022;;-0,00022;0;0,00022
186;1,882788;20,189,123,78;192,168,43,26;TLSv1,2;109;Application Data;;;;;;;1,882788;1,882788;0;;0,000166;0,000166;0
187;1,882788;20,189,123,78;192,168,43,26;TLSv1,2;112;Application Data;;;;;;;1,882788;1,882954;0,000166;;0,008516;0,008682;0,000166
188;1,882954;192,168,43,26;20,189,123,78;TCP;54;59704  >  443 [ACK] Seq=3529 Ack=339 Win=1019 Len=0;;;;;;;1,882954;1,891636;0,008682;;-0,008486;0,000196;0,008682
189;1,891636;172,217,194,94;192,168,43,26;TCP;1414;80  >  59703 [ACK] Seq=150961 Ack=1 Win=261 Len=1360;;;;;;;1,891636;1,891832;0,000196;;0,026517;0,026713;0,000196
190;1,891832;192,168,43,26;172,217,194,94;TCP;54;59703  >  80 [ACK] Seq=1 Ack=152321 Win=520 Len=0;;;;;;;1,891832;1,918545;0,026713;;-0,013554;0,013159;0,026713
191;1,918545;172,217,194,94;192,168,43,26;TCP;1414;80  >  59703 [PSH, ACK] Seq=152321 Ack=1 Win=261 Len=1360;;;;;;;1,918545;1,931704;0,013159;;-0,012876;0,000283;0,013159
192;1,931704;172,217,194,94;192,168,43,26;TCP;1414;80  >  59703 [ACK] Seq=153681 Ack=1 Win=261 Len=1360;;;;;;;1,931704;1,931987;0,000283;;0,027299;0,027582;0,000283
193;1,931987;192,168,43,26;172,217,194,94;TCP;54;59703  >  80 [ACK] Seq=1 Ack=155041 Win=520 Len=0;;;;;;;1,931987;1,959569;0,027582;;-0,014132;0,01345;0,027582
194;1,959569;172,217,194,94;192,168,43,26;TCP;1414;80  >  59703 [ACK] Seq=155041 Ack=1 Win=261 Len=1360;;;;;;;1,959569;1,973019;0,01345;;-0,013144;0,000306;0,01345
195;1,973019;172,217,194,94;192,168,43,26;TCP;1414;80  >  59703 [ACK] Seq=156401 Ack=1 Win=261 Len=1360;;;;;;;1,973019;1,973325;0,000306;;0,017361;0,017667;0,000306
196;1,973325;192,168,43,26;172,217,194,94;TCP;54;59703  >  80 [ACK] Seq=1 Ack=157761 Win=520 Len=0;;;;;;;1,973325;1,990992;0,017667;;-0,002387;0,01528;0,017667
197;1,990992;172,217,194,94;192,168,43,26;TCP;1414;80  >  59703 [ACK] Seq=157761 Ack=1 Win=261 Len=1360;;;;;;;1,990992;2,006272;0,01528;;-0,015018;0,000262;0,01528
198;2,006272;172,217,194,94;192,168,43,26;TCP;1414;80  >  59703 [ACK] Seq=159121 Ack=1 Win=261 Len=1360;;;;;;;2,006272;2,006534;0,000262;;0,024432;0,024694;0,000262
199;2,006534;192,168,43,26;172,217,194,94;TCP;54;59703  >  80 [ACK] Seq=1 Ack=160481 Win=520 Len=0;;;;;;;2,006534;2,031228;0,024694;;-0,007766;0,016928;0,024694
200;2,031228;172,217,194,94;192,168,43,26;TCP;1414;80  >  59703 [ACK] Seq=160481 Ack=1 Win=261 Len=1360;;;;;;;2,031228;2,048156;0,016928;;-0,016669;0,000259;0,016928
201;2,048156;172,217,194,94;192,168,43,26;TCP;1414;80  >  59703 [ACK] Seq=161841 Ack=1 Win=261 Len=1360;;;;;;;2,048156;2,048415;0,000259;;0,022719;0,022978;0,000259
202;2,048415;192,168,43,26;172,217,194,94;TCP;54;59703  >  80 [ACK] Seq=1 Ack=163201 Win=520 Len=0;;;;;;;2,048415;2,071393;0,022978;;-0,022709;0,000269;0,022978
203;2,071393;172,217,194,94;192,168,43,26;TCP;1414;80  >  59703 [ACK] Seq=163201 Ack=1 Win=261 Len=1360;;;;;;;2,071393;2,071662;0,000269;;-6,3E-05;0,000206;0,000269
204;2,071662;172,217,194,94;192,168,43,26;TCP;1414;80  >  59703 [ACK] Seq=164561 Ack=1 Win=261 Len=1360;;;;;;;2,071662;2,071868;0,000206;;0,021092;0,021298;0,000206
205;2,071868;192,168,43,26;172,217,194,94;TCP;54;59703  >  80 [ACK] Seq=1 Ack=165921 Win=520 Len=0;;;;;;;2,071868;2,093166;0,021298;;-0,001882;0,019416;0,021298
206;2,093166;172,217,194,94;192,168,43,26;TCP;1414;80  >  59703 [ACK] Seq=165921 Ack=1 Win=261 Len=1360;;;;;;;2,093166;2,112582;0,019416;;-0,019168;0,000248;0,019416
207;2,112582;172,217,194,94;192,168,43,26;TCP;1414;80  >  59703 [ACK] Seq=167281 Ack=1 Win=261 Len=1360;;;;;;;2,112582;2,112830;0,000248;;0,009757;0,010005;0,000248
208;2,112830;192,168,43,26;172,217,194,94;TCP;54;59703  >  80 [ACK] Seq=1 Ack=168641 Win=520 Len=0;;;;;;;2,112830;2,122835;0,010005;;0,003967;0,013972;0,010005
209;2,122835;172,217,194,94;192,168,43,26;TCP;1414;80  >  59703 [ACK] Seq=168641 Ack=1 Win=261 Len=1360;;;;;;;2,122835;2,136807;0,013972;;-0,013748;0,000224;0,013972
210;2,136807;172,217,194,94;192,168,43,26;TCP;1414;80  >  59703 [ACK] Seq=170001 Ack=1 Win=261 Len=1360;;;;;;;2,136807;2,137031;0,000224;;0,030502;0,030726;0,000224
211;2,137031;192,168,43,26;172,217,194,94;TCP;54;59703  >  80 [ACK] Seq=1 Ack=171361 Win=520 Len=0;;;;;;;2,137031;2,167757;0,030726;;-0,030509;0,000217;0,030726
212;2,167757;172,217,194,94;192,168,43,26;TCP;1414;80  >  59703 [ACK] Seq=171361 Ack=1 Win=261 Len=1360;;;;;;;2,167757;2,167974;0,000217;;4E-06;0,000221;0,000217
213;2,167974;172,217,194,94;192,168,43,26;TCP;1414;80  >  59703 [ACK] Seq=172721 Ack=1 Win=261 Len=1360;;;;;;;2,167974;2,168195;0,000221;;0,022213;0,022434;0,000221
214;2,168195;192,168,43,26;172,217,194,94;TCP;54;59703  >  80 [ACK] Seq=1 Ack=174081 Win=520 Len=0;;;;;;;2,168195;2,190629;0,022434;;-0,01639;0,006044;0,022434
215;2,190629;172,217,194,94;192,168,43,26;TCP;1414;80  >  59703 [ACK] Seq=174081 Ack=1 Win=261 Len=1360;;;;;;;2,190629;2,196673;0,006044;;-0,005802;0,000242;0,006044
216;2,196673;172,217,194,94;192,168,43,26;TCP;1414;80  >  59703 [ACK] Seq=175441 Ack=1 Win=261 Len=1360;;;;;;;2,196673;2,196915;0,000242;;0,034179;0,034421;0,000242
217;2,196915;192,168,43,26;172,217,194,94;TCP;54;59703  >  80 [ACK] Seq=1 Ack=176801 Win=520 Len=0;;;;;;;2,196915;2,231336;0,034421;;-0,034053;0,000368;0,034421
218;2,231336;172,217,194,94;192,168,43,26;TCP;1414;80  >  59703 [ACK] Seq=176801 Ack=1 Win=261 Len=1360;;;;;;;2,231336;2,231704;0,000368;;-0,000368;0;0,000368
219;2,231704;172,217,194,94;192,168,43,26;TCP;1414;80  >  59703 [ACK] Seq=178161 Ack=1 Win=261 Len=1360;;;;;;;2,231704;2,231704;0;;0,000362;0,000362;0
220;2,231704;172,217,194,94;192,168,43,26;TCP;1414;80  >  59703 [ACK] Seq=179521 Ack=1 Win=261 Len=1360;;;;;;;2,231704;2,232066;0,000362;;0,04051;0,040872;0,000362
221;2,232066;192,168,43,26;172,217,194,94;TCP;54;59703  >  80 [ACK] Seq=1 Ack=180881 Win=520 Len=0;;;;;;;2,232066;2,272938;0,040872;;-0,040367;0,000505;0,040872
222;2,272938;172,217,194,94;192,168,43,26;TCP;1414;80  >  59703 [ACK] Seq=180881 Ack=1 Win=261 Len=1360;;;;;;;2,272938;2,273443;0,000505;;0,00398;0,004485;0,000505
223;2,273443;192,168,43,26;172,217,194,94;TCP;54;59703  >  80 [ACK] Seq=1 Ack=182241 Win=520 Len=0;;;;;;;2,273443;2,277928;0,004485;;-2,3E-05;0,004462;0,004485
224;2,277928;172,217,194,94;192,168,43,26;TCP;1414;80  >  59703 [ACK] Seq=182241 Ack=1 Win=261 Len=1360;;;;;;;2,277928;2,282390;0,004462;;-0,004258;0,000204;0,004462
225;2,282390;172,217,194,94;192,168,43,26;TCP;1414;80  >  59703 [ACK] Seq=183601 Ack=1 Win=261 Len=1360;;;;;;;2,282390;2,282594;0,000204;;0,02928;0,029484;0,000204
226;2,282594;192,168,43,26;172,217,194,94;TCP;54;59703  >  80 [ACK] Seq=1 Ack=184961 Win=520 Len=0;;;;;;;2,282594;2,312078;0,029484;;-0,028835;0,000649;0,029484
227;2,312078;192,168,43,26;52,184,93,80;TCP;66;59713  >  443 [SYN] Seq=0 Win=65535 Len=0 MSS=1460 WS=256 SACK_PERM=1;;;;;;;2,312078;2,312727;0,000649;;0,015739;0,016388;0,000649
228;2,312727;172,217,194,94;192,168,43,26;TCP;1414;80  >  59703 [ACK] Seq=184961 Ack=1 Win=261 Len=1360;;;;;;;2,312727;2,329115;0,016388;;-0,016053;0,000335;0,016388
229;2,329115;172,217,194,94;192,168,43,26;TCP;1414;80  >  59703 [ACK] Seq=186321 Ack=1 Win=261 Len=1360;;;;;;;2,329115;2,329450;0,000335;;0,007977;0,008312;0,000335
230;2,329450;192,168,43,26;172,217,194,94;TCP;54;59703  >  80 [ACK] Seq=1 Ack=187681 Win=520 Len=0;;;;;;;2,329450;2,337762;0,008312;;0,013162;0,021474;0,008312
231;2,337762;172,217,194,94;192,168,43,26;TCP;1414;80  >  59703 [ACK] Seq=187681 Ack=1 Win=261 Len=1360;;;;;;;2,337762;2,359236;0,021474;;-0,021254;0,00022;0,021474
232;2,359236;172,217,194,94;192,168,43,26;TCP;1414;80  >  59703 [ACK] Seq=189041 Ack=1 Win=261 Len=1360;;;;;;;2,359236;2,359456;0,00022;;0,017676;0,017896;0,00022
233;2,359456;192,168,43,26;172,217,194,94;TCP;54;59703  >  80 [ACK] Seq=1 Ack=190401 Win=520 Len=0;;;;;;;2,359456;2,377352;0,017896;;0,011737;0,029633;0,017896
234;2,377352;172,217,194,94;192,168,43,26;TCP;1414;80  >  59703 [ACK] Seq=190401 Ack=1 Win=261 Len=1360;;;;;;;2,377352;2,406985;0,029633;;-0,029402;0,000231;0,029633
235;2,406985;172,217,194,94;192,168,43,26;TCP;1414;80  >  59703 [ACK] Seq=191761 Ack=1 Win=261 Len=1360;;;;;;;2,406985;2,407216;0,000231;;0,023248;0,023479;0,000231
236;2,407216;192,168,43,26;172,217,194,94;TCP;54;59703  >  80 [ACK] Seq=1 Ack=193121 Win=520 Len=0;;;;;;;2,407216;2,430695;0,023479;;-0,013826;0,009653;0,023479
237;2,430695;172,217,194,94;192,168,43,26;TCP;1414;80  >  59703 [ACK] Seq=193121 Ack=1 Win=261 Len=1360;;;;;;;2,430695;2,440348;0,009653;;-0,009466;0,000187;0,009653
238;2,440348;172,217,194,94;192,168,43,26;TCP;1414;80  >  59703 [ACK] Seq=194481 Ack=1 Win=261 Len=1360;;;;;;;2,440348;2,440535;0,000187;;0;0,000187;0,000187
239;2,440535;192,168,43,26;172,217,194,94;TCP;54;59703  >  80 [ACK] Seq=1 Ack=195841 Win=520 Len=0;;;;;;;2,440535;2,440722;0,000187;;0,013069;0,013256;0,000187
240;2,440722;172,217,194,94;192,168,43,26;TCP;1414;80  >  59703 [ACK] Seq=195841 Ack=1 Win=261 Len=1360;;;;;;;2,440722;2,453978;0,013256;;-0,013012;0,000244;0,013256
241;2,453978;52,184,93,80;192,168,43,26;TCP;66;443  >  59713 [SYN, ACK] Seq=0 Ack=1 Win=13600 Len=0 MSS=1360 WS=1 SACK_PERM=1;;;;;;;2,453978;2,454222;0,000244;;0,000626;0,00087;0,000244
242;2,454222;192,168,43,26;52,184,93,80;TCP;54;59713  >  443 [ACK] Seq=1 Ack=1 Win=262144 Len=0;;;;;;;2,454222;2,455092;0,00087;;0,014787;0,015657;0,00087
243;2,455092;192,168,43,26;52,184,93,80;TLSv1,2;301;Client Hello;;;;;;;2,455092;2,470749;0,015657;;-0,015456;0,000201;0,015657
244;2,470749;172,217,194,94;192,168,43,26;TCP;1414;80  >  59703 [ACK] Seq=197201 Ack=1 Win=261 Len=1360;;;;;;;2,470749;2,470950;0,000201;;0,008279;0,00848;0,000201
245;2,470950;192,168,43,26;172,217,194,94;TCP;54;59703  >  80 [ACK] Seq=1 Ack=198561 Win=520 Len=0;;;;;;;2,470950;2,479430;0,00848;;0,004168;0,012648;0,00848
246;2,479430;172,217,194,94;192,168,43,26;TCP;1414;80  >  59703 [ACK] Seq=198561 Ack=1 Win=261 Len=1360;;;;;;;2,479430;2,492078;0,012648;;-0,012458;0,00019;0,012648
247;2,492078;172,217,194,94;192,168,43,26;TCP;1414;80  >  59703 [ACK] Seq=199921 Ack=1 Win=261 Len=1360;;;;;;;2,492078;2,492268;0,00019;;0,018646;0,018836;0,00019
